{
  "schemaVersion": "1.0",
  "id": "shadow-sim-pro",
  "kind": "project",
  "identity": {
    "name": "SHADOW SIM PRO — projeto de estudo",
    "nature": "study",
    "role": "Desenvolvimento para estudo",
    "repositoryUrl": "https://github.com/SladeSouzaSantos/shadow_simulator",
    "demoUrl": null,
    "visibility": "public"
  },
  "classification": {
    "applicationType": "data",
    "domains": [],
    "engineeringAreas": []
  },
  "summary": {
    "functional": "SHADOW SIM PRO: Ferramenta de estudo de sombreamento que calcula posições solares por localização e data, com visualizações de trajetória e relatórios horários.",
    "technical": "SHADOW SIM PRO: Ferramenta de estudo de sombreamento que calcula posições solares por localização e data, com visualizações de trajetória e relatórios horários. Pontos implementados/documentados: Cálculos astronômicos de azimute e altitude solar. Dashboard e gráficos interativos com Streamlit e Plotly. Pipeline de deploy com Docker Swarm, Tailscale e GitHub Actions descrita no README.. Tecnologias registradas neste projeto: Python, Streamlit, Plotly, Docker Swarm, GitHub Actions. Projeto ou exercício de estudo, não emprego nem produto comercial validado.",
    "problemSolved": null
  },
  "stack": [
    {
      "name": "Python",
      "kind": "language",
      "usage": "documented",
      "evidenceLevel": "declared",
      "evidenceIds": [
        "catalog"
      ]
    },
    {
      "name": "Streamlit",
      "kind": "library",
      "usage": "documented",
      "evidenceLevel": "declared",
      "evidenceIds": [
        "catalog"
      ]
    },
    {
      "name": "Plotly",
      "kind": "tool",
      "usage": "documented",
      "evidenceLevel": "declared",
      "evidenceIds": [
        "catalog"
      ]
    },
    {
      "name": "Docker Swarm",
      "kind": "infrastructure",
      "usage": "documented",
      "evidenceLevel": "declared",
      "evidenceIds": [
        "catalog"
      ]
    },
    {
      "name": "GitHub Actions",
      "kind": "infrastructure",
      "usage": "documented",
      "evidenceLevel": "declared",
      "evidenceIds": [
        "catalog"
      ]
    }
  ],
  "architecture": {
    "style": "unknown",
    "components": [],
    "patterns": [],
    "dataFlow": null
  },
  "features": [],
  "engineering": {
    "tests": [],
    "quality": [],
    "ciCd": [],
    "deployment": [],
    "security": []
  },
  "competencies": [
    {
      "name": "Experiência demonstrada: data",
      "demonstrates": "Este projeto documenta competências em Python, Streamlit, Plotly, Docker Swarm, GitHub Actions; diferenciar código efetivamente revisto de tecnologias apenas declaradas.",
      "evidenceLevel": "declared",
      "evidenceIds": [
        "catalog"
      ]
    }
  ],
  "limitations": [],
  "evidence": [
    {
      "id": "catalog",
      "type": "portfolio_record",
      "url": null,
      "path": "knowledge/portfolio.json",
      "note": "Curadoria do catálogo profissional: conferir a fonte externa antes de elevar o nível de comprovação."
    }
  ],
  "sync": {
    "sourceRepository": "SladeSouzaSantos/shadow_simulator",
    "sourcePath": null,
    "sourceRef": null,
    "sourceCommit": null,
    "lastModifiedAt": null,
    "checkedAt": "2026-10-31T19:43:18.186Z",
    "analyzedAt": "2026-10-31T19:43:18.186Z",
    "reviewedAt": null,
    "verificationStatus": "catalog_only",
    "syncEligible": true
  }
}
