{
  "schemaVersion": "1.0",
  "id": "resergas",
  "kind": "project",
  "identity": {
    "name": "ReserGas — propriedades de gás de reservatório",
    "nature": "personal",
    "role": "Autor do projeto",
    "repositoryUrl": "https://github.com/SladeSouzaSantos/reser_gas",
    "demoUrl": null,
    "visibility": "public"
  },
  "classification": {
    "applicationType": "mobile",
    "domains": [],
    "engineeringAreas": []
  },
  "summary": {
    "functional": "ReserGas é um projeto mobile público de Pedro Santos para cálculo de propriedades de gás natural e gás de reservatório.",
    "technical": "ReserGas é um projeto mobile público de Pedro Santos para cálculo de propriedades de gás natural e gás de reservatório. Usa Flutter e Dart, com telas, modelos de domínio e casos de uso. O README apresenta entradas por composição, densidade ou massa molecular e cálculos de fator de compressibilidade, viscosidade, propriedades pseudocríticas, massa específica e fator volume-formação. CalcularFactorZ implementa a correlação Dranchuk e Abou-Kassem. O repositório contém testes Dart.",
    "problemSolved": "Calcular propriedades físico-químicas de gases de reservatório em aplicativo móvel."
  },
  "stack": [
    {
      "name": "Flutter",
      "kind": "framework",
      "usage": "documented",
      "evidenceLevel": "declared",
      "evidenceIds": ["catalog"]
    },
    {
      "name": "Dart",
      "kind": "language",
      "usage": "documented",
      "evidenceLevel": "declared",
      "evidenceIds": ["catalog"]
    }
  ],
  "architecture": {
    "style": "clean",
    "components": ["Telas Flutter", "Modelos de domínio", "Casos de uso"],
    "patterns": [],
    "dataFlow": "Entradas por composição/densidade/massa molecular -> cálculo de propriedades -> resultados na UI."
  },
  "features": [
    {
      "name": "Cálculo de propriedades de gás",
      "description": "Viscosidade, compressibilidade, pseudocríticas e propriedades de reservatório.",
      "status": "documented",
      "evidenceIds": ["catalog"]
    }
  ],
  "engineering": {
    "tests": [
      {
        "name": "Testes Dart",
        "scope": "Testes presentes no repositório, sem resultados de execução atuais.",
        "evidenceIds": ["catalog"]
      }
    ],
    "quality": [],
    "ciCd": [],
    "deployment": [],
    "security": []
  },
  "competencies": [
    {
      "name": "Experiência demonstrada: mobile",
      "demonstrates": "Este projeto documenta competências em Flutter, Dart; diferenciar código efetivamente revisto de tecnologias apenas declaradas.",
      "evidenceLevel": "declared",
      "evidenceIds": ["catalog"]
    }
  ],
  "limitations": [
    {
      "topic": "Uso profissional comercial",
      "status": "not_verified",
      "description": "Projeto autoral não comprova implantação comercial."
    }
  ],
  "evidence": [
    {
      "id": "catalog",
      "type": "portfolio_record",
      "url": null,
      "path": "knowledge/portfolio.json",
      "note": "Curadoria do catálogo profissional: conferir a fonte externa antes de elevar o nível de comprovação."
    }
  ],
  "sync": {
    "sourceRepository": "SladeSouzaSantos/reser_gas",
    "sourcePath": null,
    "sourceRef": "main",
    "sourceCommit": "2a0f2c8e791a8541b905808b66d97e373340e5b7",
    "lastModifiedAt": "2025-10-20T21:10:59Z",
    "checkedAt": "2026-10-31T19:43:18.186Z",
    "analyzedAt": "2026-10-31T19:43:18.186Z",
    "reviewedAt": null,
    "verificationStatus": "catalog_only",
    "syncEligible": true
  }
}
