{
  "schemaVersion": "1.0",
  "id": "numero-secreto",
  "kind": "project",
  "identity": {
    "name": "NÚMERO SECRETO — projeto de estudo",
    "nature": "study",
    "role": "Desenvolvimento para estudo",
    "repositoryUrl": "https://github.com/SladeSouzaSantos/n-secreto",
    "demoUrl": "https://projetos.phasscode.com/projetos/n_secreto/",
    "visibility": "public"
  },
  "classification": {
    "applicationType": "frontend",
    "domains": [],
    "engineeringAreas": []
  },
  "summary": {
    "functional": "NÚMERO SECRETO: Jogo de adivinhação de números de 1 a 1000 com reconhecimento de voz, indicações de maior ou menor e opção de reiniciar.",
    "technical": "NÚMERO SECRETO: Jogo de adivinhação de números de 1 a 1000 com reconhecimento de voz, indicações de maior ou menor e opção de reiniciar. Pontos implementados/documentados: Integração com a Web Speech API para reconhecer números falados. Validação de palpites e feedback sobre o valor secreto. Tratamento de vitória e reinício; requer navegador compatível e acesso ao microfone.. Tecnologias registradas neste projeto: HTML, CSS, JavaScript, Web Speech API. Projeto ou exercício de estudo, não emprego nem produto comercial validado. A demonstração exige navegador compatível com Web Speech API e permissão de microfone.",
    "problemSolved": null
  },
  "stack": [
    {
      "name": "HTML",
      "kind": "library",
      "usage": "documented",
      "evidenceLevel": "declared",
      "evidenceIds": [
        "catalog"
      ]
    },
    {
      "name": "CSS",
      "kind": "library",
      "usage": "documented",
      "evidenceLevel": "declared",
      "evidenceIds": [
        "catalog"
      ]
    },
    {
      "name": "JavaScript",
      "kind": "language",
      "usage": "documented",
      "evidenceLevel": "declared",
      "evidenceIds": [
        "catalog"
      ]
    },
    {
      "name": "Web Speech API",
      "kind": "library",
      "usage": "documented",
      "evidenceLevel": "declared",
      "evidenceIds": [
        "catalog"
      ]
    }
  ],
  "architecture": {
    "style": "unknown",
    "components": [],
    "patterns": [],
    "dataFlow": null
  },
  "features": [],
  "engineering": {
    "tests": [],
    "quality": [],
    "ciCd": [],
    "deployment": [],
    "security": []
  },
  "competencies": [
    {
      "name": "Experiência demonstrada: frontend",
      "demonstrates": "Este projeto documenta competências em HTML, CSS, JavaScript, Web Speech API; diferenciar código efetivamente revisto de tecnologias apenas declaradas.",
      "evidenceLevel": "declared",
      "evidenceIds": [
        "catalog"
      ]
    }
  ],
  "limitations": [],
  "evidence": [
    {
      "id": "catalog",
      "type": "portfolio_record",
      "url": null,
      "path": "knowledge/portfolio.json",
      "note": "Curadoria do catálogo profissional: conferir a fonte externa antes de elevar o nível de comprovação."
    }
  ],
  "sync": {
    "sourceRepository": "SladeSouzaSantos/n-secreto",
    "sourcePath": null,
    "sourceRef": null,
    "sourceCommit": null,
    "lastModifiedAt": null,
    "checkedAt": "2026-10-31T19:43:18.186Z",
    "analyzedAt": "2026-10-31T19:43:18.186Z",
    "reviewedAt": null,
    "verificationStatus": "catalog_only",
    "syncEligible": true
  }
}
