{
  "schemaVersion": "1.0",
  "id": "gemini-nano-browser",
  "kind": "project",
  "identity": {
    "name": "GEMINI NANO — projeto de estudo",
    "nature": "study",
    "role": "Desenvolvimento para estudo",
    "repositoryUrl": "https://github.com/SladeSouzaSantos/web-ai-gemini-nano-browser",
    "demoUrl": null,
    "visibility": "public"
  },
  "classification": {
    "applicationType": "ai",
    "domains": [],
    "engineeringAreas": []
  },
  "summary": {
    "functional": "GEMINI NANO: Experimento com modelos de linguagem locais via APIs do navegador, integrando interação textual, tradução e detecção de idioma.",
    "technical": "GEMINI NANO: Experimento com modelos de linguagem locais via APIs do navegador, integrando interação textual, tradução e detecção de idioma. Pontos implementados/documentados: Uso experimental de Prompt API, Translation API e Language Detection API. Processamento no cliente em navegadores e versões compatíveis. Exploração de privacidade e latência em modelos pequenos executados localmente.. Tecnologias registradas neste projeto: JavaScript, HTML, CSS, Web AI APIs, Gemini Nano. Projeto ou exercício de estudo, não emprego nem produto comercial validado.",
    "problemSolved": null
  },
  "stack": [
    {
      "name": "JavaScript",
      "kind": "language",
      "usage": "documented",
      "evidenceLevel": "declared",
      "evidenceIds": [
        "catalog"
      ]
    },
    {
      "name": "HTML",
      "kind": "library",
      "usage": "documented",
      "evidenceLevel": "declared",
      "evidenceIds": [
        "catalog"
      ]
    },
    {
      "name": "CSS",
      "kind": "library",
      "usage": "documented",
      "evidenceLevel": "declared",
      "evidenceIds": [
        "catalog"
      ]
    },
    {
      "name": "Web AI APIs",
      "kind": "library",
      "usage": "documented",
      "evidenceLevel": "declared",
      "evidenceIds": [
        "catalog"
      ]
    },
    {
      "name": "Gemini Nano",
      "kind": "library",
      "usage": "documented",
      "evidenceLevel": "declared",
      "evidenceIds": [
        "catalog"
      ]
    }
  ],
  "architecture": {
    "style": "unknown",
    "components": [],
    "patterns": [],
    "dataFlow": null
  },
  "features": [],
  "engineering": {
    "tests": [],
    "quality": [],
    "ciCd": [],
    "deployment": [],
    "security": []
  },
  "competencies": [
    {
      "name": "Experiência demonstrada: ai",
      "demonstrates": "Este projeto documenta competências em JavaScript, HTML, CSS, Web AI APIs, Gemini Nano; diferenciar código efetivamente revisto de tecnologias apenas declaradas.",
      "evidenceLevel": "declared",
      "evidenceIds": [
        "catalog"
      ]
    }
  ],
  "limitations": [],
  "evidence": [
    {
      "id": "catalog",
      "type": "portfolio_record",
      "url": null,
      "path": "knowledge/portfolio.json",
      "note": "Curadoria do catálogo profissional: conferir a fonte externa antes de elevar o nível de comprovação."
    }
  ],
  "sync": {
    "sourceRepository": "SladeSouzaSantos/web-ai-gemini-nano-browser",
    "sourcePath": null,
    "sourceRef": null,
    "sourceCommit": null,
    "lastModifiedAt": null,
    "checkedAt": "2026-10-31T19:43:18.186Z",
    "analyzedAt": "2026-10-31T19:43:18.186Z",
    "reviewedAt": null,
    "verificationStatus": "catalog_only",
    "syncEligible": true
  }
}
